title,description
Flutter Developer,Looking for Flutter developer with 2+ years experience in mobile app development
Node.js Backend Developer,Seeking backend developer with Node.js and PostgreSQL experience
React Frontend Developer,Need React developer with strong JavaScript and UI skills
HR Executive,Looking for HR executive with recruitment experience
QA Engineer,Need QA engineer for manual and automation testing
DevOps Engineer,Looking for DevOps engineer with Docker and CI/CD experience
Full Stack Developer,Seeking full stack developer with React and Node.js experience
Android Developer,Need Android developer with Kotlin experience
iOS Developer,Looking for iOS developer with Swift experience
Technical Support Engineer,Need technical support engineer for client support
